{
  "id": "adrenaline",
  "label": "Adrenaline System",
  "polarities": [
    "light",
    "dark"
  ],
  "style": {
    "base": {
      "note": {
        "--font-text-theme": "\"Adrenaline Body\", \"Noto Serif\", Georgia, serif",
        "--font-header-theme": "\"Adrenaline Display\", \"Roboto Condensed\", sans-serif",
        "--font-monospace-theme": "\"Courier Prime\", monospace",
        "--inline-title-font": "\"Adrenaline Display\", \"Roboto Condensed\", sans-serif",
        "--inline-title-text-transform": "uppercase",
        "--inline-title-weight": "800",
        "--h1-font": "\"Adrenaline Display\", \"Roboto Condensed\", sans-serif",
        "--h1-text-transform": "uppercase",
        "--h1-weight": "800",
        "--h2-font": "\"Adrenaline Display\", \"Roboto Condensed\", sans-serif",
        "--h2-text-transform": "uppercase",
        "--h2-weight": "800",
        "--h3-font": "\"Adrenaline Display\", \"Roboto Condensed\", sans-serif",
        "--h3-text-transform": "uppercase",
        "--h3-weight": "700",
        "--radius-s": "1px",
        "--radius-m": "2px",
        "--radius-l": "2px",
        "--checkbox-radius": "0px",
        "--tag-radius": "1px",
        "--code-radius": "1px",
        "--link-decoration": "none",
        "--link-decoration-hover": "underline"
      },
      "workspace": {}
    },
    "light": {
      "note": {
        "--color-accent": "#9D2416",
        "--interactive-accent": "#9D2416",
        "--accent-h": "6.22",
        "--accent-s": "75.42%",
        "--accent-l": "35.1%",
        "--background-primary": "#F4F0E8",
        "--background-primary-alt": "#ECE7DE",
        "--background-secondary": "#DDD8CF",
        "--text-normal": "#211A18",
        "--text-muted": "#655A55",
        "--text-faint": "#95877F",
        "--h1-color": "#71170F",
        "--h2-color": "#8B2115",
        "--h3-color": "#9D2416",
        "--code-background": "#ECE7DE",
        "--code-normal": "#71170F",
        "--background-modifier-border": "#B8ADA4",
        "--blockquote-border-color": "#9D2416",
        "--text-highlight-bg": "#E46B463D",
        "--adrenaline-panel": "#F8F5EF",
        "--adrenaline-section-band": "#CBC6BC",
        "--adrenaline-section-band-ink": "#3A211C",
        "--adrenaline-band": "#71170F",
        "--adrenaline-band-ink": "#FFF8F0",
        "--adrenaline-rule": "#9D2416",
        "--adrenaline-page-texture": "var(--brumes-image-paper-grain, none)",
        "--adrenaline-page-texture-opacity": "0.32",
        "--adrenaline-cartouche": "#211A18",
        "--adrenaline-cartouche-ink": "#FFF8F0",
        "--adrenaline-signal": "#B98522",
        "--adrenaline-signal-ink": "#1A100D",
        "--adrenaline-callout-surface": "#E0D0D0",
        "--adrenaline-callout-ink": "#211A18",
        "--adrenaline-callout-title": "#211A18",
        "--adrenaline-callout-border": "#71170F",
        "--adrenaline-callout-info": "#E4DDC3",
        "--adrenaline-callout-success": "#DEE4D9",
        "--adrenaline-callout-question": "#F0EDE0",
        "--adrenaline-callout-warning": "#EADDCB",
        "--adrenaline-callout-danger": "#EDC0BB",
        "--adrenaline-callout-example": "#E3E1C0",
        "--adrenaline-callout-quote": "#D8CFCA",
        "--adrenaline-resume-accent": "#71170F",
        "--adrenaline-resume-accent-ink": "#FFF4E9",
        "--adrenaline-warning-texture": "var(--brumes-image-warning-stripe, none)",
        "--adrenaline-text-backplate": "#F8F5EF",
        "--color-red": "#9D2416",
        "--color-red-rgb": "157, 36, 22",
        "--color-orange": "#C44925",
        "--color-orange-rgb": "196, 73, 37",
        "--color-yellow": "#A66C16",
        "--color-yellow-rgb": "166, 108, 22",
        "--color-green": "#4F6D45",
        "--color-green-rgb": "79, 109, 69",
        "--color-cyan": "#39727A",
        "--color-cyan-rgb": "57, 114, 122",
        "--color-blue": "#3F5874",
        "--color-blue-rgb": "63, 88, 116",
        "--color-purple": "#6D4D70",
        "--color-purple-rgb": "109, 77, 112",
        "--color-pink": "#9B4A59",
        "--color-pink-rgb": "155, 74, 89",
        "--bold-color": "#71170F",
        "--link-color": "#9D2416",
        "--link-color-hover": "#C44925",
        "--list-marker-color": "#9D2416",
        "--checkbox-color": "#9D2416",
        "--table-header-color": "#71170F",
        "--tag-color": "#FFF8F0",
        "--tag-background": "#71170F"
      },
      "workspace": {
        "--background-primary": "#F4F0E8",
        "--background-primary-alt": "#ECE7DE",
        "--background-secondary": "#DDD8CF",
        "--background-secondary-alt": "#71170F",
        "--text-normal": "#211A18",
        "--text-muted": "#655A55",
        "--text-faint": "#95877F",
        "--background-modifier-border": "#B8ADA4",
        "--background-modifier-hover": "#E5DED4",
        "--interactive-accent": "#9D2416",
        "--brumes-root-split-background": "#ECE7DE"
      }
    },
    "dark": {
      "note": {
        "--color-accent": "#F05A32",
        "--interactive-accent": "#F05A32",
        "--accent-h": "12.63",
        "--accent-s": "86.36%",
        "--accent-l": "56.86%",
        "--background-primary": "#160D0B",
        "--background-primary-alt": "#21100E",
        "--background-secondary": "#2B1210",
        "--text-normal": "#F4E9DF",
        "--text-muted": "#C9B8AD",
        "--text-faint": "#8F7B71",
        "--h1-color": "#FFF4E9",
        "--h2-color": "#F05A32",
        "--h3-color": "#E78463",
        "--code-background": "#2B1210",
        "--code-normal": "#FFF4E9",
        "--background-modifier-border": "#6B4038",
        "--blockquote-border-color": "#F05A32",
        "--text-highlight-bg": "#F05A323D",
        "--adrenaline-panel": "#2B1210",
        "--adrenaline-section-band": "#51302A",
        "--adrenaline-section-band-ink": "#FFF4E9",
        "--adrenaline-band": "#71170F",
        "--adrenaline-band-ink": "#FFF4E9",
        "--adrenaline-rule": "#F05A32",
        "--adrenaline-page-texture": "var(--brumes-image-dark-organic, none)",
        "--adrenaline-page-texture-opacity": "0.2",
        "--adrenaline-cartouche": "#71170F",
        "--adrenaline-cartouche-ink": "#FFF4E9",
        "--adrenaline-signal": "#D5A34B",
        "--adrenaline-signal-ink": "#160D0B",
        "--adrenaline-callout-surface": "#2B1210",
        "--adrenaline-callout-ink": "#F4E9DF",
        "--adrenaline-callout-title": "#FFF4E9",
        "--adrenaline-callout-border": "#F05A32",
        "--adrenaline-callout-info": "#34201C",
        "--adrenaline-callout-success": "#263126",
        "--adrenaline-callout-question": "#342D20",
        "--adrenaline-callout-warning": "#3B2B1D",
        "--adrenaline-callout-danger": "#431B18",
        "--adrenaline-callout-example": "#302638",
        "--adrenaline-callout-quote": "#292321",
        "--adrenaline-resume-accent": "#E8B820",
        "--adrenaline-resume-accent-ink": "#160D0B",
        "--adrenaline-warning-texture": "var(--brumes-image-warning-stripe, none)",
        "--adrenaline-text-backplate": "#21100E",
        "--color-red": "#F05A32",
        "--color-red-rgb": "240, 90, 50",
        "--color-orange": "#E78463",
        "--color-orange-rgb": "231, 132, 99",
        "--color-yellow": "#D5A34B",
        "--color-yellow-rgb": "213, 163, 75",
        "--color-green": "#82A873",
        "--color-green-rgb": "130, 168, 115",
        "--color-cyan": "#69A7AD",
        "--color-cyan-rgb": "105, 167, 173",
        "--color-blue": "#7694B4",
        "--color-blue-rgb": "118, 148, 180",
        "--color-purple": "#9D7AA2",
        "--color-purple-rgb": "157, 122, 162",
        "--color-pink": "#C77886",
        "--color-pink-rgb": "199, 120, 134",
        "--bold-color": "#FFF4E9",
        "--link-color": "#F05A32",
        "--link-color-hover": "#E78463",
        "--list-marker-color": "#F05A32",
        "--checkbox-color": "#F05A32",
        "--table-header-color": "#FFF4E9",
        "--tag-color": "#FFF4E9",
        "--tag-background": "#71170F"
      },
      "workspace": {
        "--background-primary": "#160D0B",
        "--background-primary-alt": "#21100E",
        "--background-secondary": "#120806",
        "--background-secondary-alt": "#2B1210",
        "--text-normal": "#F4E9DF",
        "--text-muted": "#C9B8AD",
        "--text-faint": "#8F7B71",
        "--background-modifier-border": "#51302A",
        "--background-modifier-hover": "#321714",
        "--interactive-accent": "#F05A32",
        "--brumes-root-split-background": "#100705"
      }
    }
  },
  "assets": {
    "images": {
      "paper-grain": "paper-grain.webp",
      "dark-organic": "dark-organic.webp",
      "warning-stripe": "warning-stripe.webp"
    },
    "fonts": {
      "Adrenaline Body": {
        "file": "fonts/adrenaline-body.woff2",
        "weight": "400"
      },
      "Adrenaline Display": {
        "file": "fonts/adrenaline-display.woff2",
        "weight": "700"
      }
    }
  }
}
