{
  "id": "city-of-mist",
  "label": "City of Mist",
  "style": {
    "base": {
      "note": {
        "--font-text-theme": "\"PT Serif\", serif",
        "--font-header-theme": "\"Fira Sans Extra Condensed\", sans-serif",
        "--h4-font": "\"PT Serif\", serif",
        "--h5-font": "\"PT Serif\", serif",
        "--h6-font": "\"PT Serif\", serif",
        "--h6-size": "1.1em",
        "--inline-title-font": "\"Fira Sans Extra Condensed\", sans-serif",
        "--inline-title-text-transform": "uppercase",
        "--inline-title-weight": "800",
        "--inline-title-size": "3em",
        "--h1-font": "\"Fira Sans Extra Condensed\", sans-serif",
        "--h1-size": "3em",
        "--h1-weight": "800",
        "--h1-text-transform": "uppercase",
        "--h2-font": "\"Fira Sans Extra Condensed\", sans-serif",
        "--h2-size": "2em",
        "--h2-weight": "800",
        "--h2-text-transform": "uppercase",
        "--h3-font": "\"PT Serif\", serif",
        "--h3-text-transform": "uppercase",
        "--h4-text-transform": "uppercase",
        "--h5-text-transform": "uppercase",
        "--h6-text-transform": "uppercase",
        "--link-decoration": "underline",
        "--link-decoration-hover": "underline",
        "--link-decoration-thickness": "2px",
        "--link-external-decoration": "underline",
        "--link-external-decoration-hover": "underline",
        "--list-indent": "0em",
        "--checkbox-radius": "0px"
      }
    },
    "light": {
      "note": {
        "--color-accent": "#E6007E",
        "--interactive-accent": "#E6007E",
        "--accent-h": "327.13",
        "--accent-s": "100%",
        "--accent-l": "45.1%",
        "--background-primary": "#FFFCF7",
        "--background-primary-alt": "#00000000",
        "--color-red": "#EE5662",
        "--color-red-rgb": "238, 86, 98",
        "--color-orange": "#A95B48",
        "--color-orange-rgb": "169, 91, 72",
        "--color-yellow": "#FFF1A2",
        "--color-yellow-rgb": "255, 241, 162",
        "--color-green": "#D9E8AE",
        "--color-green-rgb": "217, 232, 174",
        "--color-blue": "#2B4E75",
        "--color-blue-rgb": "43, 78, 117",
        "--color-cyan": "#00C2F4",
        "--color-cyan-rgb": "0, 194, 244",
        "--color-purple": "#512B71",
        "--color-purple-rgb": "81, 43, 113",
        "--color-pink": "#E6007E",
        "--color-pink-rgb": "230, 0, 126",
        "--bold-color": "#000000",
        "--italic-color": "#000000",
        "--link-color": "#000000",
        "--link-color-hover": "#000000",
        "--link-external-color": "#000000",
        "--link-external-color-hover": "#000000",
        "--link-unresolved-color": "#000000",
        "--list-marker-color": "#000000",
        "--checkbox-color": "#842837",
        "--checkbox-color-hover": "#842837",
        "--tag-color": "#000000",
        "--tag-background": "#FFF1A200",
        "--tag-background-hover": "#00000000"
      },
      "workspace": {
        "--background-secondary": "#ECEAE5",
        "--background-secondary-alt": "#281C34"
      }
    },
    "dark": {
      "note": {
        "--color-accent": "#E6007E",
        "--interactive-accent": "#E6007E",
        "--accent-h": "327.13",
        "--accent-s": "100%",
        "--accent-l": "45.1%",
        "--background-primary": "#2A273F",
        "--background-primary-alt": "#00000000",
        "--text-normal": "#E0DEF4",
        "--text-muted": "#908CAA",
        "--text-faint": "#6E6A86",
        "--color-red": "#EE5662",
        "--color-red-rgb": "238, 86, 98",
        "--color-orange": "#C97A63",
        "--color-orange-rgb": "201, 122, 99",
        "--color-yellow": "#EAD98A",
        "--color-yellow-rgb": "234, 217, 138",
        "--color-green": "#9FBE7A",
        "--color-green-rgb": "159, 190, 122",
        "--color-blue": "#7AA2C8",
        "--color-blue-rgb": "122, 162, 200",
        "--color-cyan": "#00C2F4",
        "--color-cyan-rgb": "0, 194, 244",
        "--color-purple": "#A98BD0",
        "--color-purple-rgb": "169, 139, 208",
        "--color-pink": "#E6007E",
        "--color-pink-rgb": "230, 0, 126",
        "--bold-color": "#E0DEF4",
        "--italic-color": "#E0DEF4",
        "--link-color": "#E0DEF4",
        "--link-color-hover": "#FFFFFF",
        "--link-external-color": "#C4C0E0",
        "--link-external-color-hover": "#E0DEF4",
        "--link-unresolved-color": "#908CAA",
        "--list-marker-color": "#908CAA",
        "--checkbox-color": "#C4566A",
        "--checkbox-color-hover": "#D9707F",
        "--tag-color": "#E0DEF4",
        "--tag-background": "#00000000",
        "--tag-background-hover": "#00000000"
      },
      "workspace": {
        "--background-secondary": "#232136",
        "--background-secondary-alt": "#393552"
      }
    }
  },
  "assets": {
    "images": {
      "callout-edge": "callout-edge.svg",
      "iceberg-location": "iceberg-location.svg",
      "iceberg-character": "iceberg-character.svg",
      "iceberg-group": "iceberg-group.svg"
    }
  }
}
