{
  "id": "otherscape",
  "label": ":Otherscape",
  "style": {
    "base": {
      "note": {
        "--font-text-theme": "\"Roboto\", sans-serif",
        "--font-header-theme": "\"Fira Sans Extra Condensed\", sans-serif",
        "--font-monospace-theme": "\"Courier Prime\", monospace",
        "--inline-title-font": "\"Fira Sans Extra Condensed\", sans-serif",
        "--inline-title-text-transform": "uppercase",
        "--inline-title-weight": "800",
        "--inline-title-size": "3em",
        "--h1-font": "\"Fira Sans Extra Condensed\", sans-serif",
        "--h1-size": "2.6em",
        "--h1-weight": "800",
        "--h1-text-transform": "uppercase",
        "--h2-font": "\"Fira Sans Extra Condensed\", sans-serif",
        "--h2-size": "1.9em",
        "--h2-weight": "800",
        "--h2-text-transform": "uppercase",
        "--h3-font": "\"Fira Sans Extra Condensed\", sans-serif",
        "--h3-size": "1.4em",
        "--h3-weight": "700",
        "--h3-text-transform": "uppercase",
        "--h4-font": "\"Roboto\", sans-serif",
        "--h4-text-transform": "uppercase",
        "--h4-weight": "700",
        "--h5-font": "\"Roboto\", sans-serif",
        "--h5-text-transform": "uppercase",
        "--h6-font": "\"Roboto\", sans-serif",
        "--h6-text-transform": "uppercase",
        "--radius-s": "0px",
        "--radius-m": "0px",
        "--radius-l": "0px",
        "--checkbox-radius": "0px",
        "--tag-radius": "0px",
        "--code-radius": "0px",
        "--link-decoration": "none",
        "--link-decoration-hover": "underline",
        "--link-external-decoration": "none",
        "--link-external-decoration-hover": "underline",
        "--list-indent": "1.2em",
        "--blockquote-border-thickness": "3px"
      }
    },
    "light": {
      "note": {
        "--color-accent": "#0087B0",
        "--interactive-accent": "#0087B0",
        "--accent-h": "193.98",
        "--accent-s": "100%",
        "--accent-l": "34.51%",
        "--background-primary": "#F2F5F7",
        "--background-primary-alt": "#E8ECEF",
        "--background-secondary": "#E8ECEF",
        "--text-normal": "#12161B",
        "--text-muted": "#4A555F",
        "--text-faint": "#8A949D",
        "--text-highlight-bg": "#D8FF3F",
        "--h1-color": "#0B1A28",
        "--h2-color": "#0B1A28",
        "--h3-color": "#0F4C63",
        "--code-background": "#E4E9ED",
        "--blockquote-border-color": "#00A8D6",
        "--color-red": "#C4384E",
        "--color-red-rgb": "196, 56, 78",
        "--color-purple": "#7B4FB0",
        "--color-purple-rgb": "123, 79, 176",
        "--color-blue": "#2E6FA8",
        "--color-blue-rgb": "46, 111, 168",
        "--color-orange": "#D9702F",
        "--color-orange-rgb": "217, 112, 47",
        "--color-yellow": "#B8C400",
        "--color-yellow-rgb": "184, 196, 0",
        "--color-green": "#6FA81E",
        "--color-green-rgb": "111, 168, 30",
        "--color-cyan": "#0098BF",
        "--color-cyan-rgb": "0, 152, 191",
        "--color-pink": "#D4348A",
        "--color-pink-rgb": "212, 52, 138",
        "--bold-color": "#0B1A28",
        "--italic-color": "#12161B",
        "--link-color": "#0087B0",
        "--link-color-hover": "#00A8D6",
        "--link-unresolved-color": "#4A555F",
        "--link-external-color": "#0F4C63",
        "--link-external-color-hover": "#0087B0",
        "--list-marker-color": "#0087B0",
        "--checkbox-color": "#0087B0",
        "--checkbox-color-hover": "#00A8D6",
        "--table-header-color": "#0B1A28",
        "--tag-color": "#0B1A28",
        "--tag-background": "#D8FF3F",
        "--tag-background-hover": "#C6E82E",
        "--brumes-theme-self": "#C4384E",
        "--brumes-theme-mythos": "#7B4FB0",
        "--brumes-theme-noise": "#2E6FA8"
      },
      "workspace": {
        "--background-secondary": "#E1E6EA",
        "--background-secondary-alt": "#0B1A28",
        "--brumes-root-split-background": "#EAEEF1"
      }
    },
    "dark": {
      "note": {
        "--color-accent": "#3FD8FF",
        "--interactive-accent": "#3FD8FF",
        "--accent-h": "192.19",
        "--accent-s": "100%",
        "--accent-l": "62.35%",
        "--background-primary": "#0A1B2A",
        "--background-primary-alt": "#0F2436",
        "--background-secondary": "#0F2436",
        "--text-normal": "#E2EAF1",
        "--text-muted": "#95A6B5",
        "--text-faint": "#5F7285",
        "--text-highlight-bg": "#98FF0033",
        "--h1-color": "#B8F53C",
        "--h2-color": "#B8F53C",
        "--h3-color": "#3FD8FF",
        "--code-background": "#0F2436",
        "--blockquote-border-color": "#3FD8FF",
        "--color-red": "#E05A6E",
        "--color-red-rgb": "224, 90, 110",
        "--color-purple": "#A98BD0",
        "--color-purple-rgb": "169, 139, 208",
        "--color-blue": "#5D9BD4",
        "--color-blue-rgb": "93, 155, 212",
        "--color-orange": "#E89050",
        "--color-orange-rgb": "232, 144, 80",
        "--color-yellow": "#D8FF3F",
        "--color-yellow-rgb": "216, 255, 63",
        "--color-green": "#98FF00",
        "--color-green-rgb": "152, 255, 0",
        "--color-cyan": "#3FD8FF",
        "--color-cyan-rgb": "63, 216, 255",
        "--color-pink": "#F05CA8",
        "--color-pink-rgb": "240, 92, 168",
        "--bold-color": "#B8F53C",
        "--italic-color": "#E2EAF1",
        "--link-color": "#3FD8FF",
        "--link-color-hover": "#8FEFEF",
        "--link-unresolved-color": "#95A6B5",
        "--link-external-color": "#8FEFEF",
        "--link-external-color-hover": "#3FD8FF",
        "--list-marker-color": "#3FD8FF",
        "--checkbox-color": "#3FD8FF",
        "--checkbox-color-hover": "#8FEFEF",
        "--table-header-color": "#B8F53C",
        "--tag-color": "#0A1B2A",
        "--tag-background": "#98FF00",
        "--tag-background-hover": "#B8F53C",
        "--brumes-theme-self": "#E05A6E",
        "--brumes-theme-mythos": "#A98BD0",
        "--brumes-theme-noise": "#5D9BD4"
      },
      "workspace": {
        "--background-secondary": "#081521",
        "--background-secondary-alt": "#061019",
        "--brumes-root-split-background": "#07141F"
      }
    }
  },
  "assets": {
    "images": {}
  }
}
